{
  "schema": {
    "name": "scfm_eval.integration_plan",
    "version": "1.0.0"
  },
  "integration_plan_id": "example-cell-model-plan-v1",
  "created_at": "2026-07-17T22:05:00Z",
  "candidate_fingerprint": "aaaaaaaaaaaaaaaaaaaaaaaaaaaaaaaaaaaaaaaaaaaaaaaaaaaaaaaaaaaaaaaa",
  "model_spec_fingerprint": "bbbbbbbbbbbbbbbbbbbbbbbbbbbbbbbbbbbbbbbbbbbbbbbbbbbbbbbbbbbbbbbb",
  "planner": {
    "agent": "example-integration-planner",
    "backend": "example-backend",
    "run_id": "planner-run-1"
  },
  "environment": {
    "name": "example-cell-model",
    "platform": "linux-64",
    "python": "3.11.*",
    "conda_dependencies": {
      "python": "3.11.*",
      "pytorch": ">=2.1,<3"
    },
    "pypi_dependencies": {
      "example-cell-model": "==1.0.0"
    }
  },
  "installation": {
    "method": "pixi",
    "package_path": "vendor/example-cell-model",
    "editable": false,
    "no_deps": true
  },
  "generated_files": [
    {
      "path": "pixi.lock",
      "purpose": "Locked execution environment",
      "sha256": "3333333333333333333333333333333333333333333333333333333333333333"
    },
    {
      "path": "integrations/example_cell_model.py",
      "purpose": "Evaluation adapter",
      "sha256": "4444444444444444444444444444444444444444444444444444444444444444"
    },
    {
      "path": "experiments/example_cell_model.yaml",
      "purpose": "Resolved evaluation configuration",
      "sha256": "5555555555555555555555555555555555555555555555555555555555555555"
    }
  ],
  "smoke_tests": [
    {
      "test_id": "adapter-import",
      "kind": "import",
      "timeout_minutes": 2
    },
    {
      "test_id": "tiny-evaluation",
      "kind": "tiny_evaluation",
      "timeout_minutes": 10
    }
  ],
  "resources": {
    "gpu_type": "Example GPU",
    "gpu_count": 1,
    "gpu_memory_gb": 24,
    "disk_gb": 50,
    "runtime_minutes": 60,
    "estimated_cost_usd": 2
  },
  "assumptions": [
    "The published checkpoint matches the pinned repository commit."
  ],
  "risks": [
    "The example has not been executed during proposal generation."
  ],
  "unresolved_fields": []
}
